"Tipo normativo"	"Norma"	"Publicação"	"Ementa"	"Data"	"Em vigor"	"Revogada"	"Tornada sem efeito"	"Alterada"	"Outros"	"Anexos"
"Resolução"	"Resolução nº 071 de 23/01/2009"	"DOU Nº 17, S/1, p.10, 26/01/2009 (BPS, V.4, N.04 S, 26/01/2009)"	"Altera o Regimento Interno da Agência Nacional de Aviação Civil – ANAC."	"39836"	""	"Resolução Nº 110, de 15 de setembro de 2009"	""	"Resolução Nº 109, de 04 de agosto de 2009"	""	"https://www.anac.gov.br/assuntos/legislacao/legislacao-1/resolucoes/resolucoes-2009/resolucao-no-071-de-23-01-2009@@download/arquivo_norma/RA2009-0109.pdf"
"Resolução"	"Resolução nº 070 de 15/01/2009"	"DOU Nº 11, S/1, p.10, 14/01/2009"	"Aprova a Instrução Suplementar Nº21.181-001, que estabelece procedimentos para a revalidação de  Certificados  de Aeronavegabilidade."	"39828"	""	"Resolução Nº 147, de 17 de março de 2010"	""	""	""	"https://www.anac.gov.br/assuntos/legislacao/legislacao-1/resolucoes/resolucoes-2009/resolucao-no-070-de-15-01-2009@@download/arquivo_norma/RA2009-0070.pdf"
"Resolução"	"Resolução nº 069 de 13/01/2009"	"DOU Nº 9, S/1, p.6, 7, 14/01/2009"	"Aprova nova  redação para os itens 7.4 e 8.1.8 e para o  capítulo 13 da IAC 3108 e revoga o capítulo 12 e os anexo 21, 22, 22A e 24 da referida Instrução."	"39826"	""	""	""	""	""	"https://www.anac.gov.br/assuntos/legislacao/legislacao-1/resolucoes/resolucoes-2009/resolucao-no-069-de-13-01-2009@@download/arquivo_norma/RA2009-0069.pdf"
"Resolução"	"Resolução nº 088 de 11/05/2009"	"DOU Nº 88, S/1, p. 146, 12/05/2009"	"Revoga o item 3.1 do capítulo 3 da IAC 4302-0501, estabelece parâmetros em testes de calibração e de monitoramento de atrito em pistas de pouso e decolagem e dá outras providências."	"39944"	""	"Resolução Nº 236, de 5 de junho de 2012 que entrará em vigor em 10 de agosto de 2012"	""	""	""	"https://www.anac.gov.br/assuntos/legislacao/legislacao-1/resolucoes/resolucoes-2009/resolucao-no-088-de-11-05-2009@@download/arquivo_norma/RA2009-0088.pdf"
"Resolução"	"Resolução nº 087 de 11/05/2009"	"DOU Nº 88, S/1, p. 145, 12/05/2009"	"Aprova a Instrução Suplementar Nº 145.109-001A."	"39944"	""	""	""	""	""	"https://www.anac.gov.br/assuntos/legislacao/legislacao-1/resolucoes/resolucoes-2009/resolucao-no-087-de-11-05-2009@@download/arquivo_norma/RA2009-0087.pdf"
"Resolução"	"Resolução nº 086 de 11/05/2009"	"DOU Nº 88, S/1, p. 145, 12/05/2009"	"Aprova a Instrução Suplementar Nº 120-001A."	"39944"	""	""	""	""	""	"https://www.anac.gov.br/assuntos/legislacao/legislacao-1/resolucoes/resolucoes-2009/resolucao-no-086-de-11-05-2009@@download/arquivo_norma/RA2009-0086.pdf"
"Resolução"	"Resolução nº 085 de 11/05/2009"	"DOU Nº 88, S/1, p. 145, 12/05/2009"	"Aprova a Instrução Suplementar Nº 43-001A."	"39944"	""	""	""	""	""	"https://www.anac.gov.br/assuntos/legislacao/legislacao-1/resolucoes/resolucoes-2009/resolucao-no-085-de-11-05-2009@@download/arquivo_norma/RA2009-0085.pdf"
"Resolução"	"Resolução nº 084 de 11/05/2009"	"DOU Nº 88, S/1, p. 145, 12/05/2009"	"Aprova o Programa de Segurança Operacional Específico da Agência Nacional de Aviação Civil (PSOE-ANAC)."	"39944"	""	"Resolução Nº 352, de 10 de fevereiro de 2015"	""	""	""	"https://www.anac.gov.br/assuntos/legislacao/legislacao-1/resolucoes/resolucoes-2009/resolucao-no-084-de-11-05-2009@@download/arquivo_norma/RA2009-0084.pdf"
"Resolução"	"Resolução nº 073 de 11/02/2009"	"DOU Nº 36, S/1, p.8, 20/02/2009"	"Aprova o Regulamento Brasileiro de Aviação Civil – RBAC 11, que estabelece os procedimentos e as normas gerais para a elaboração de regras e emendas aos Regulamentos Brasileiros da Aviação Civil."	"39855"	""	""	""	""	""	"https://www.anac.gov.br/assuntos/legislacao/legislacao-1/resolucoes/resolucoes-2009/resolucao-no-073-de-11-02-2009@@download/arquivo_norma/RA2009-0073.pdf"
"Resolução"	"Resolução nº 178 de 21/12/2010"	"DOU Nº 244, S/1, p. 22, 22/12/2010"	"Estabelece os procedimentos para comunicação de pouso ou sobrevoo e solicitação de permanência no território brasileiro por aeronave civil estrangeira realizando transporte aéreo não remunerado."	"40533"	""	""	""	""	""	"https://www.anac.gov.br/assuntos/legislacao/legislacao-1/resolucoes/resolucoes-2010/resolucao-no-178-de-21-12-2010@@download/arquivo_norma/A2010-0178.pdf"
"Resolução"	"Resolução nº 177 de 14/12/2010"	"DOU Nº 239, S/1, p. 31, 15/12/2010"	"Aprova condição especial para o avião Embraer EMB-500, aplicável ao assento orientado transversalmente, para um único ocupante."	"40526"	""	""	""	""	""	"https://www.anac.gov.br/assuntos/legislacao/legislacao-1/resolucoes/resolucoes-2010/resolucao-no-177-de-14-12-2010@@download/arquivo_norma/A2010-0177.pdf"
"Resolução"	"Resolução nº 176 de 14/12/2010"	"DOU Nº 239, S/1, p. 31, 15/12/2010"	"Revoga a IAC 3511."	"40526"	""	""	""	""	""	"https://www.anac.gov.br/assuntos/legislacao/legislacao-1/resolucoes/resolucoes-2010/resolucao-no-176-de-14-12-2010@@download/arquivo_norma/A2010-0176.pdf"
"Resolução"	"Resolução nº 173 de 28/09/2010"	"DOU Nº 187, S/1, p. 9, 29/09/2010 "	"Aprova a Emenda Nº 01 ao Regulamento Brasileiro de Aviação Civil Nº 119."	"40449"	""	""	""	""	""	"https://www.anac.gov.br/assuntos/legislacao/legislacao-1/resolucoes/resolucoes-2010/resolucao-no-173-de-28-09-2010@@download/arquivo_norma/A2010-0173.pdf"
"Resolução"	"Resolução nº 172 de 26/08/2010"	"DOU Nº 165, S/1, p. 11, 27/08/2010 "	"Estabelece critérios para vistorias e inspeções de aeronave no que se refere à Segurança da Aviação Civil contra Atos de Interferência Ilícita."	"40416"	""	"Resolução Nº 254, de 6 de novembro de 2012, em vigor em 7 de maio 2013."	""	""	""	"https://www.anac.gov.br/assuntos/legislacao/legislacao-1/resolucoes/resolucoes-2010/resolucao-no-172-de-26-08-2010@@download/arquivo_norma/A2010-0172.pdf"
"Resolução"	"Resolução nº 171 de 24/08/2010"	"DOU Nº 163, S/1, p. 12, 25/08/2010 "	"Aprova a Emenda Nº 01 ao Regulamento Brasileiro da Aviação Civil Nº 111."	"40414"	""	""	""	""	""	"https://www.anac.gov.br/assuntos/legislacao/legislacao-1/resolucoes/resolucoes-2010/resolucao-no-171-de-24-08-2010@@download/arquivo_norma/A2010-0171.pdf"
"Resolução"	"Resolução nº 170 de 24/08/2010"	"DOU Nº 163, S/1, p. 12, 25/08/2010 "	"Altera o art. 16 da Resolução Nº 113, de 22 de setembro de 2009."	"40414"	""	""	""	""	""	"https://www.anac.gov.br/assuntos/legislacao/legislacao-1/resolucoes/resolucoes-2010/resolucao-no-170-de-24-08-2010@@download/arquivo_norma/A2010-0170.pdf"
"Resolução"	"Resolução nº 169 de 24/08/2010"	"DOU Nº 163, S/1, p. 12, 25/08/2010 "	"Aprova o Regulamento Brasileiro da Aviação Civil Nº 135."	"40414"	""	""	""	""	""	"https://www.anac.gov.br/assuntos/legislacao/legislacao-1/resolucoes/resolucoes-2010/resolucao-no-169-de-24-08-2010@@download/arquivo_norma/A2010-0169.pdf"
"Resolução"	"Resolução nº 168 de 17/08/2010"	"DOU Nº 158, S/1, p. 12, 18/08/2010"	"Dispõe sobre os procedimentos a serem observados no canal de inspeção de segurança da aviação civil contra atos de interferência ilícita nos aeroportos e dá outras providências. "	"40407"	""	"Resolução Nº 207, de 22 de novembro de 2011"	""	""	""	"https://www.anac.gov.br/assuntos/legislacao/legislacao-1/resolucoes/resolucoes-2010/resolucao-no-168-de-17-08-2010@@download/arquivo_norma/A2010-0168.pdf"
"Resolução"	"Resolução nº 167 de 17/08/2010"	"DOU Nº 158, S/1, p. 12, 18/08/2010"	"Estabelece diretrizes para o gerenciamento de risco à Segurança da Aviação Civil contra Atos de Interferência Ilícita (AVSEC) pela ANAC."	"40407"	""	""	""	""	""	"https://www.anac.gov.br/assuntos/legislacao/legislacao-1/resolucoes/resolucoes-2010/resolucao-no-167-de-17-08-2010@@download/arquivo_norma/A2010-0167.pdf"
"Resolução"	"Resolução nº 164 de 29/07/2010"	"DOU Nº 145, S/1, p. 6, 30/07/2010"	"Revoga a IAC 109-1001."	"40388"	""	""	""	""	""	"https://www.anac.gov.br/assuntos/legislacao/legislacao-1/resolucoes/resolucoes-2010/resolucao-no-164-de-29-07-2010@@download/arquivo_norma/A2010-0164.pdf"
"Resolução"	"Resolução nº 163 de 22/07/2010"	"DOU Nº 140, S/1, p. 6, 23/07/2010"	"Altera o Regulamento Brasileiro de Homologação Aeronáutica 137. "	"40381"	""	"Resolução Nº 233, de 30 de maio de 2012"	""	""	""	"https://www.anac.gov.br/assuntos/legislacao/legislacao-1/resolucoes/resolucoes-2010/resolucao-no-163-de-22-07-2010@@download/arquivo_norma/A2010-0163.pdf"
"Resolução"	"Resolução nº 162 de 20/07/2010"	"DOU Nº 138, S/1, p. 69, 21/07/2010 (Retificação noDOU Nº 140, S/1, p. 6, 23/07/2010)"	"Altera disposições sobre a edição de Regulamentos Brasileiros da Aviação Civil e de Instruções Suplementares pela Agência Nacional de Aviação Civil - ANAC."	"40379"	""	""	""	""	""	"https://www.anac.gov.br/assuntos/legislacao/legislacao-1/resolucoes/resolucoes-2010/resolucao-no-162-de-20-07-2010@@download/arquivo_norma/RA2010-0162 cons c retif.pdf"
"Resolução"	"Resolução nº 161 de 15/07/2010"	"DOU Nº 135, S/1, p. 6-7, 16/07/2010"	"Revoga a IAC 107-1012."	"40374"	""	""	""	""	""	"https://www.anac.gov.br/assuntos/legislacao/legislacao-1/resolucoes/resolucoes-2010/resolucao-no-161-de-15-07-2010@@download/arquivo_norma/A2010-0161.pdf"
"Resolução"	"Resolução nº 160 de 15/07/2010"	"DOU Nº 135, S/1, p. 6, 16/07/2010"	"Revoga a IAC 108-1012."	"40374"	""	""	""	""	""	"https://www.anac.gov.br/assuntos/legislacao/legislacao-1/resolucoes/resolucoes-2010/resolucao-no-160-de-15-07-2010@@download/arquivo_norma/A2010-0160.pdf"
"Resolução"	"Resolução nº 159 de 15/07/2010"	"DOU Nº 135, S/1, p. 6, 16/07/2010"	"Revoga a IAC 107-1007."	"40374"	""	""	""	""	""	"https://www.anac.gov.br/assuntos/legislacao/legislacao-1/resolucoes/resolucoes-2010/resolucao-no-159-de-15-07-2010@@download/arquivo_norma/A2010-0159.pdf"
"Resolução"	"Resolução nº 158 de 13/07/2010"	"DOU Nº 133, S/1, p. 15-16, 14/07/2010"	"Dispõe sobre a autorização prévia para a construção de aeródromos e seu cadastramento junto à ANAC."	"40372"	""	""	""	"Resolução nº 484, de 26 de julho de 2018."	"<a class="external-link" href="https://www.anac.gov.br/assuntos/legislacao/legislacao-1/portarias/2018/portaria-no-3352-sia-30-10-2018"_blank" title="">Ver também Portaria nº 3352/SIA, 30/10/2018</a>"	"https://www.anac.gov.br/assuntos/legislacao/legislacao-1/resolucoes/resolucoes-2010/resolucao-no-158-de-13-07-2010@@download/arquivo_norma/RA2010-0158 - Compilado até RA2018-0484.pdf"
"Resolução"	"Resolução nº 154 de 25/06/2010"	"DOU Nº 121, S/1, p. 64-67, 28/06/2010"	"Altera dispositivos da Resolução Nº 57, de 10 de outubro de 2008, que regulamenta o processo de alocação de frequências internacionais e de designação de empresas aéreas regulares brasileiras."	"40354"	""	""	""	""	""	"https://www.anac.gov.br/assuntos/legislacao/legislacao-1/resolucoes/resolucoes-2010/resolucao-no-154-de-25-06-2010@@download/arquivo_norma/A2010-0154.pdf"
"Resolução"	"Resolução nº 153 de 18/06/2010"	"DOU Nº 116, S/1, p. 70-71, 21/06/2010 (Retificação noDOU Nº 118, S/1, p. 13, 23/06/2010)"	"Dispõe sobre a aprovação de Planos Diretores Aeroportuários."	"40347"	""	""	""	"Resolução nº 270, de 9 de abril de 2013."	"<a class="external-link" href="https://www.anac.gov.br/assuntos/legislacao/legislacao-1/portarias/2018/portaria-no-3352-sia-30-10-2018" target="_blank" title="">Ver também Portaria nº 3352/SIA, de 30/10/2018</a>"	"https://www.anac.gov.br/assuntos/legislacao/legislacao-1/resolucoes/resolucoes-2010/resolucao-no-153-de-18-06-2010@@download/arquivo_norma/A2010-0153.pdf"
"Resolução"	"Resolução nº 152 de 17/06/2010"	"DOU Nº 115, S/1, p. 36, 18/06/2010"	"Aprova o Regulamento Brasileiro de Aviação Civil Nº 111."	"40346"	""	"Resolução nº 500, de 12 de dezembro de 2018."	""	""	""	"https://www.anac.gov.br/assuntos/legislacao/legislacao-1/resolucoes/resolucoes-2010/resolucao-no-152-de-17-06-2010@@download/arquivo_norma/A2010-0152.pdf"
"Resolução"	"Resolução nº 150 de 30/04/2010"	"DOU Nº 82, S/1, p. 37, 03/05/2010"	"Regulamenta a avaliação institucional do primeiro ciclo de avaliação de desempenho para fins de gratificação e dá outras providências."	"40298"	""	""	""	""	""	"https://www.anac.gov.br/assuntos/legislacao/legislacao-1/resolucoes/resolucoes-2010/resolucao-no-150-de-30-04-2010@@download/arquivo_norma/A2010-0150.pdf"
"Resolução"	"Resolução nº 149 de 27/04/2010"	"DOU Nº 81, S/1, p. 33, 30/04/2010"	"Aprova condição especial para o avião Embraer ERJ 190, aplicável aos assentos com grandes painéis não metálicos e não tradicionais."	"40295"	""	""	""	""	""	"https://www.anac.gov.br/assuntos/legislacao/legislacao-1/resolucoes/resolucoes-2010/resolucao-no-149-de-27-04-2010@@download/arquivo_norma/A2010-0149.pdf"
"Resolução"	"Resolução nº 148 de 17/03/2010"	"DOU Nº 54, S/1, p. 16, 22/03/2010"	"Altera dispositivos do Regimento Interno da ANAC."	"40254"	""	""	""	""	""	"https://www.anac.gov.br/assuntos/legislacao/legislacao-1/resolucoes/resolucoes-2010/resolucao-no-148-de-17-03-2010@@download/arquivo_norma/A2010-0148.pdf"
"Resolução"	"Resolução nº 147 de 17/03/2010"	"DOU Nº 54, S/1, p. 16, 22/03/2010"	"Aprova a Instrução Suplementar Nº 21.181-001, Revisão B."	"40254"	""	""	""	""	""	"https://www.anac.gov.br/assuntos/legislacao/legislacao-1/resolucoes/resolucoes-2010/resolucao-no-147-de-17-03-2010@@download/arquivo_norma/A2010-0147.pdf"
"Resolução"	"Resolução nº 146 de 17/03/2010"	"DOU Nº 54, S/1, p. 16, 22/03/2010"	"Aprova o Regulamento Brasileiro da Aviação Civil Nº 121."	"40254"	""	""	""	""	""	"https://www.anac.gov.br/assuntos/legislacao/legislacao-1/resolucoes/resolucoes-2010/resolucao-no-146-de-17-03-2010@@download/arquivo_norma/A2010-0146.pdf"
"Resolução"	"Resolução nº 145 de 17/03/2010"	"DOU Nº 54, S/1, p. 15-16, 22/03/2010"	"Aprova o Regulamento Brasileiro da Aviação Civil Nº 45."	"40254"	""	""	""	""	""	"https://www.anac.gov.br/assuntos/legislacao/legislacao-1/resolucoes/resolucoes-2010/resolucao-no-145-de-17-03-2010@@download/arquivo_norma/A2010-0145.pdf"
"Resolução"	"Resolução nº 144 de 17/03/2010"	"DOU Nº 54, S/1, p. 15, 22/03/2010"	"Aprova o Regulamento Brasileiro da Aviação Civil Nº 26."	"40254"	""	""	""	""	""	"https://www.anac.gov.br/assuntos/legislacao/legislacao-1/resolucoes/resolucoes-2010/resolucao-no-144-de-17-03-2010@@download/arquivo_norma/A2010-0144.pdf"
"Resolução"	"Resolução nº 143 de 17/03/2010"	"DOU Nº 54, S/1, p. 15, 22/03/2010"	"Aprova o RBAC Nº 21 em substituição aos RBHAs 21, 22 e 26."	"40254"	""	""	""	""	""	"https://www.anac.gov.br/assuntos/legislacao/legislacao-1/resolucoes/resolucoes-2010/resolucao-no-143-de-17-03-2010@@download/arquivo_norma/A2010-0143.pdf"
"Resolução"	"Resolução nº 175 de 09/11/2010"	"DOU Nº 216, S/1, p. 6, 11/11/2010"	"Revoga a IAC 3141."	"40491"	""	""	""	""	""	"https://www.anac.gov.br/assuntos/legislacao/legislacao-1/resolucoes/resolucoes-2010/resolucao-no-175-de-09-11-2010@@download/arquivo_norma/A2010-0175.pdf"
"Resolução"	"Resolução nº 174 de 09/11/2010"	"DOU Nº 216, S/1, p. 6, 11/11/2010"	"Aprova o Regulamento Brasileiro da Aviação Civil Nº 133."	"40491"	""	""	""	""	""	"https://www.anac.gov.br/assuntos/legislacao/legislacao-1/resolucoes/resolucoes-2010/resolucao-no-174-de-09-11-2010@@download/arquivo_norma/A2010-0174.pdf"
"Resolução"	"Resolução nº 165 de 06/08/2010"	"DOU Nº 152, S/1, p. 99, 10/08/2010"	"Altera a Resolução Nº 151, de 7 de maio de 2010, que institui o Sistema Decolagem Certa – DCERTA."	"40396"	""	"Resolução Nº 268, de 18 de março de 2013 que entrará em vigor em 17 de junho de 2013"	""	""	""	"https://www.anac.gov.br/assuntos/legislacao/legislacao-1/resolucoes/resolucoes-2010/resolucao-no-165-de-06-08-2010@@download/arquivo_norma/A2010-0165.pdf"
"Resolução"	"Resolução nº 157 de 06/07/2010"	"DOU Nº 128, S/1, p. 22, 07/07/2010"	"Dispõe sobre a obrigatoriedade do Programa de Segurança de Empresa Aérea (PSEA) para empresas de transporte aéreo operando no Brasil."	"40365"	""	"Resolução Nº 254, de 6 de novembro de 2012, em vigor em 7 de maio de 2013"	""	""	""	"https://www.anac.gov.br/assuntos/legislacao/legislacao-1/resolucoes/resolucoes-2010/resolucao-no-157-de-06-07-2010@@download/arquivo_norma/A2010-0157.pdf"
"Resolução"	"Resolução nº 156 de 06/07/2010"	"DOU Nº 128, S/1, p. 22, 07/07/2010"	"Altera o Programa Nacional de Instrução em Segurança de Aviação Civil."	"40365"	""	""	""	""	""	"https://www.anac.gov.br/assuntos/legislacao/legislacao-1/resolucoes/resolucoes-2010/resolucao-no-156-de-06-07-2010@@download/arquivo_norma/A2010-0156.pdf"
"Resolução"	"Resolução nº 155 de 01/07/2010"	"DOU Nº 125, S/1, p. 60, 02/07/2010 (Retificação noDOU Nº 126, S/1, p. 5, 05/07/2010)"	"Aprova condição especial para o avião Embraer EMB-135BJ Enhanced, aplicável à parada súbita de motor e APU."	"40360"	""	""	""	""	""	"https://www.anac.gov.br/assuntos/legislacao/legislacao-1/resolucoes/resolucoes-2010/resolucao-no-155-de-01-07-2010@@download/arquivo_norma/A2010-0155.pdf"
"Resolução"	"Resolução nº 151 de 07/05/2010"	"DOU Nº 87, S/1, p. 14, 10/05/2010"	"Institui o Sistema de Decolagem Certa – DCERTA."	"40305"	""	"Resolução Nº 268, de 18 de março de 2013 que entrará em vigor em 17 de junho de 2013"	""	""	""	"https://www.anac.gov.br/assuntos/legislacao/legislacao-1/resolucoes/resolucoes-2010/resolucao-no-151-de-07-05-2010@@download/arquivo_norma/A2010-0151.pdf"
"Resolução"	"Resolução nº 142 de 09/03/2010"	"DOU Nº 53, S/1, p. 13, 19/03/2010"	"Altera dispositivos do Regimento Interno da ANAC."	"40246"	""	""	""	""	""	"https://www.anac.gov.br/assuntos/legislacao/legislacao-1/resolucoes/resolucoes-2010/resolucao-no-142-de-09-03-2010@@download/arquivo_norma/A2010-0142.pdf"
"Resolução"	"Resolução nº 141 de 09/03/2010"	"DOU Nº 49, S/1, p. 7-8, 15/03/2010"	"Dispõe sobre as Condições Gerais de Transporte aplicáveis aos atrasos e cancelamentos de voos e às hipóteses de preterição de passageiros e dá outras providências."	"40246"	""	"Pela Resolução nº 400, de 13 de dezembro de 2016."	""	""	""	"https://www.anac.gov.br/assuntos/legislacao/legislacao-1/resolucoes/resolucoes-2010/resolucao-no-141-de-09-03-2010@@download/arquivo_norma/A2010-0141.pdf, https://www.anac.gov.br/assuntos/legislacao/legislacao-1/resolucoes/resolucoes-2010/resolucao-no-141-de-09-03-2010@@download/anexo_norma/CEF Res 141 Emd 00.pdf"
"Resolução"	"Resolução nº 140 de 09/03/2010"	"DOU Nº 48, S/1, p. 14, 12/03/2010"	"Regulamenta o registro de tarifas referentes aos serviços de transporte aéreo regular."	"40246"	""	""	""	""	""	"https://www.anac.gov.br/assuntos/legislacao/legislacao-1/resolucoes/resolucoes-2010/resolucao-no-140-de-09-03-2010@@download/arquivo_norma/RA2010-0140 - Compilada até RA2016-0400.pdf, https://www.anac.gov.br/assuntos/legislacao/legislacao-1/resolucoes/resolucoes-2010/resolucao-no-140-de-09-03-2010@@download/anexo_norma/CEF Resolução nº 140-2010.pdf"
"Resolução"	"Resolução nº 139 de 09/03/2010"	"DOU Nº 48, S/1, p. 14, 12/03/2010 (DOU Nº 100, S/1, p. 13, 27/05/2010)"	"Regulamenta os procedimentos de comercialização dos serviços de transporte aéreo de carga, doméstico e internacional."	"40246"	""	""	""	""	""	"https://www.anac.gov.br/assuntos/legislacao/legislacao-1/resolucoes/resolucoes-2010/resolucao-no-139-de-09-03-2010@@download/arquivo_norma/A2010-0139.pdf"
"Resolução"	"Resolução nº 138 de 09/03/2010"	"DOU Nº 48, S/1, p. 13-14, 12/03/2010"	"Dispõe sobre as condições gerais de transporte atinentes à comercialização e às características do bilhete de passagem e dá outras disposições."	"40246"	""	"Pela Resolução nº 400, de 13 de dezembro de 2016."	""	""	""	"https://www.anac.gov.br/assuntos/legislacao/legislacao-1/resolucoes/resolucoes-2010/resolucao-no-138-de-09-03-2010@@download/arquivo_norma/A2010-0138.pdf"
"Resolução"	"Resolução nº 137 de 09/03/2010"	"DOU Nº 48, S/1, p. 13, 12/03/2010"	"Altera a competência para compor, administrativamente, conflitos de interesses que envolvam administradores aeroportuários e empresas de serviços aéreos e de serviços auxiliares."	"40246"	""	""	""	""	""	"https://www.anac.gov.br/assuntos/legislacao/legislacao-1/resolucoes/resolucoes-2010/resolucao-no-137-de-09-03-2010@@download/arquivo_norma/A2010-0137.pdf"
"Resolução"	"Resolução nº 136 de 09/03/2010"	"DOU Nº 48, S/1, p. 13, 12/03/2010"	"Altera a Resolução Nº 111, de 15 de setembro de 2009, e aprova o Regimento Interno da Junta Recursal da ANAC."	"40246"	""	"Resolução nº 448, de 20 de setembro de 2017."	""	""	""	"https://www.anac.gov.br/assuntos/legislacao/legislacao-1/resolucoes/resolucoes-2010/resolucao-no-136-de-09-03-2010@@download/arquivo_norma/A2010-0136.pdf"
"Resolução"	"Resolução nº 135 de 09/03/2010"	"DOU Nº 47, S/1, p. 4-5, 11/03/2010"	"Institui o Programa de Avaliação Dimensional – Selo ANAC."	"40246"	""	""	""	""	""	"https://www.anac.gov.br/assuntos/legislacao/legislacao-1/resolucoes/resolucoes-2010/resolucao-no-135-de-09-03-2010@@download/arquivo_norma/A2010-0135 com anexo.pdf, https://www.anac.gov.br/assuntos/legislacao/legislacao-1/resolucoes/resolucoes-2010/resolucao-no-135-de-09-03-2010@@download/anexo_norma/Programa de Avaliacao Dimensional - Selo ANAC (1).pdf"
"Resolução"	"Resolução nº 133 de 12/01/2010"	"DOU Nº 9, S/1, p. 31, 14/01/2010"	"Revoga a IAC Nº 3129."	"40190"	""	""	""	""	""	"https://www.anac.gov.br/assuntos/legislacao/legislacao-1/resolucoes/resolucoes-2010/resolucao-no-133-de-12-01-2010@@download/arquivo_norma/A2010-0133.pdf"
"Resolução"	"Resolução nº 132 de 12/01/2010"	"DOU Nº 9, S/1, p. 31, 14/01/2010"	"Altera dispositivo do Regimento Interno da ANAC."	"40190"	""	""	""	""	""	"https://www.anac.gov.br/assuntos/legislacao/legislacao-1/resolucoes/resolucoes-2010/resolucao-no-132-de-12-01-2010@@download/arquivo_norma/A2010-0132.pdf"
"Resolução"	"Resolução nº 134 de 19/01/2010"	"DOU Nº 13, S/1, p. 7, 20/01/2010"	"Altera dispositivos do Regimento Interno da ANAC."	"40197"	""	""	""	""	""	"https://www.anac.gov.br/assuntos/legislacao/legislacao-1/resolucoes/resolucoes-2010/resolucao-no-134-de-19-01-2010@@download/arquivo_norma/Resolu%C3%A7%C3%A3o n%C2%BA 134, de 19.01.10 - Altera%C3%A7%C3%A3o do Regimento Interno.pdf"
"Resolução"	"Resolução nº 212 de 29/12/2011"	"DOU Nº 251, S/1, p.5, 30/12/2011 "	"Altera o item 35.3 do Anexo à Resolução Nº 115, de 6 de outubro de 2009."	"40906"	""	""	""	""	""	"https://www.anac.gov.br/assuntos/legislacao/legislacao-1/resolucoes/resolucoes-2011/resolucao-no-212-de-29-12-2011@@download/arquivo_norma/RA2011-0212.pdf"
"Resolução"	"Resolução nº 210 de 29/11/2011"	"DOU Nº 230, S/1, p.28, 01/12/2011 "	"Aprova a Emenda Nº 01 ao Regulamento Brasileiro da Aviação Civil Nº 21, revoga o Regulamento Brasileiro de Homologação Aeronáutica 38 e dá outras providências."	"40876"	""	""	""	""	""	"https://www.anac.gov.br/assuntos/legislacao/legislacao-1/resolucoes/resolucoes-2011/resolucao-no-210-de-29-11-2011@@download/arquivo_norma/RA2011-0210.pdf"
"Resolução"	"Resolução nº 209 de 29/11/2011"	"DOU Nº 230, S/1, p.28, 01/12/2011 "	"Revoga a Instrução de Aviação Civil 3144 (IAC 3144)."	"40876"	""	""	""	""	""	"https://www.anac.gov.br/assuntos/legislacao/legislacao-1/resolucoes/resolucoes-2011/resolucao-no-209-de-29-11-2011@@download/arquivo_norma/RA2011-0209.pdf"
"Resolução"	"Resolução nº 208 de 22/11/2011"	"DOU Nº 227, S/1, p.4-5, 28/11/2011"	"Estabelece regras específicas para compartilhar instalações e sistemas de atendimento destinados ao processamento de passageiros e despacho de bagagens nos aeródromos brasileiros. "	"40869"	""	"Art. 7º revogado pela Resolução Nº 302, de 05 de fevereiro de 2014."	""	""	""	"https://www.anac.gov.br/assuntos/legislacao/legislacao-1/resolucoes/resolucoes-2011/resolucao-no-208-de-22-11-2011@@download/arquivo_norma/RA2011-0208.pdf"
"Resolução"	"Resolução nº 207 de 22/11/2011"	"DOU Nº 227, S/1, p. 2-4, 28/11/2011"	"Dispõe sobre os procedimentos de inspeção de segurança da aviação civil contra atos de interferência ilícita nos aeroportos e dá outras providências."	"40869"	""	"Resolução nº 515, de 8 de maio de 2019."	""	"Resolução nº 278, de 10 de julho de 2013."	""	"https://www.anac.gov.br/assuntos/legislacao/legislacao-1/resolucoes/resolucoes-2011/resolucao-no-207-de-22-11-2011@@download/arquivo_norma/RA2011-0207.pdf"
"Resolução"	"Resolução nº 206 de 16/11/2011"	"DOU Nº 225, S/1, p. 1, 24/11/2011"	"Delega competência para aprovação de Planos de Zoneamento de Ruído."	"40863"	""	""	""	""	""	"https://www.anac.gov.br/assuntos/legislacao/legislacao-1/resolucoes/resolucoes-2011/resolucao-no-206-de-16-11-2011@@download/arquivo_norma/RA2011-0206.pdf"
"Resolução"	"Resolução nº 202 de 28/09/2011"	"DOU Nº 188, S/1, p. 25, 29/09/2011"	"Aprova o Regulamento Brasileiro de Aviação Civil Nº 161."	"40814"	""	""	""	""	""	"https://www.anac.gov.br/assuntos/legislacao/legislacao-1/resolucoes/resolucoes-2011/resolucao-no-202-de-28-09-2011@@download/arquivo_norma/RA2011-0202.pdf"
"Resolução"	"Resolução nº 201 de 22/09/2011"	"DOU Nº 184, S/1, p. 4, 23/09/2011"	"Altera dispositivo da Resolução Nº 113, de 22 de setembro de 2009."	"40808"	""	"Resolução Nº 302, de 05 de fevereiro de 2014"	""	""	""	"https://www.anac.gov.br/assuntos/legislacao/legislacao-1/resolucoes/resolucoes-2011/resolucao-no-201-de-22-09-2011@@download/arquivo_norma/RA2011-0201.pdf"
"Resolução"	"Resolução nº 200 de 13/09/2011"	"DOU Nº 177, S/1, p.1-2, 14/09/2011 "	"Aprova a Emenda Nº 02 ao Regulamento Brasileiro da Aviação Civil Nº 01."	"40799"	""	""	""	""	""	"https://www.anac.gov.br/assuntos/legislacao/legislacao-1/resolucoes/resolucoes-2011/resolucao-no-200-de-13-09-2011@@download/arquivo_norma/RA2011-0200.pdf"
